{
  "evidence_manifest_ref": "evmanifest-135f09d8-6919-43a7-af4b-1a0bf3215759",
  "fuzzing": {
    "executed": false
  },
  "id": "testev-5a9c511e-7c8d-4374-801f-348e1397b910",
  "integrity_signature": "fixture",
  "property_tests": {
    "cases_run": 1,
    "executed": true,
    "framework": "fixture",
    "violations": 0
  },
  "test_environment": {
    "container_image": "fixture"
  },
  "unit_tests": {
    "count": 1,
    "coverage_percent": 100.0,
    "executed": true,
    "failed": 0,
    "passed": 1
  }
}