{
  "evidence_manifest_ref": "evmanifest-84f49b25-1569-4896-9945-52eb71a9e29b",
  "fuzzing": {
    "executed": false
  },
  "id": "testev-371d56b2-9725-4b63-be01-08d430811174",
  "integrity_signature": "fixture",
  "property_tests": {
    "cases_run": 1,
    "executed": true,
    "framework": "fixture",
    "violations": 0
  },
  "test_environment": {
    "container_image": "fixture"
  },
  "unit_tests": {
    "count": 1,
    "coverage_percent": 100.0,
    "executed": true,
    "failed": 0,
    "passed": 1
  }
}