{
  "evidence_manifest_ref": "fixture:B",
  "fuzzing": {
    "executed": false
  },
  "id": "testev-B",
  "integrity_signature": "fixture",
  "property_tests": {
    "cases_run": 1200,
    "executed": true,
    "framework": "fixture",
    "violations": 0
  },
  "test_environment": {
    "container_image": "fixture"
  },
  "unit_tests": {
    "count": 24,
    "coverage_percent": 78.4,
    "executed": true,
    "failed": 1,
    "passed": 23
  }
}