{
  "evidence_manifest_ref": "evmanifest-58718b09-4cb0-46c3-b702-20dc87b22808",
  "fuzzing": {
    "executed": false
  },
  "id": "testev-f67a8e9c-e364-44d4-9918-29e28b6768bd",
  "integrity_signature": "fixture",
  "property_tests": {
    "cases_run": 1,
    "executed": true,
    "framework": "fixture",
    "violations": 0
  },
  "test_environment": {
    "container_image": "fixture"
  },
  "unit_tests": {
    "count": 1,
    "coverage_percent": 100.0,
    "executed": true,
    "failed": 0,
    "passed": 1
  }
}