{
  "evidence_manifest_ref": "evmanifest-3d3cba69-3a26-429c-859f-8066387bb476",
  "fuzzing": {
    "executed": false
  },
  "id": "testev-bdc4b892-3614-4720-b1c4-7abe270bc0ee",
  "integrity_signature": "fixture",
  "property_tests": {
    "cases_run": 1,
    "executed": true,
    "framework": "fixture",
    "violations": 0
  },
  "test_environment": {
    "container_image": "fixture"
  },
  "unit_tests": {
    "count": 1,
    "coverage_percent": 100.0,
    "executed": true,
    "failed": 0,
    "passed": 1
  }
}